{
  "kind": "Delegation",
  "api_version": "v1",
  "id": "dlg_9a3c5e7i1b2d4f60",
  "tenant_id": "tnt_9d4c1e2a3b4f5c67",
  "run_id": "run_6d4f8a2b0c1e3579",
  "parent_actor": "act_worker-7f3k2m",
  "child_actor": "act_subagent-91xz4",
  "depth": 1,
  "capabilities": {
    "allowed_action_classes": ["A0", "A1"],
    "allowed_destinations": ["sink://patch-export-beta"],
    "allowed_resources": ["repo://fixture-checkout"]
  },
  "cumulative_budget": {
    "max_total_cost": { "currency": "USD", "micros": 5000000 },
    "max_total_tokens": 8000000,
    "max_effects": 40
  },
  "state": "active",
  "created_at": "2026-09-11T20:42:10Z"
}
